{
  "worker_id": "worker-demo-project",
  "alias": "Demo Project Worker",
  "assistant_code": "B_demo_project",
  "assistant_level": "B",
  "window_title": "Demo Project",
  "project_root": "..",
  "agent_root": ".",
  "status": "registered",
  "scope": [
    "Coordinate the demo project",
    "Own project-level handoff and reporting"
  ],
  "staffing_standard_path": "../../../../docs/governance.md",
  "communication_standard_path": "../../../../coordination/README.md",
  "profile_standard_path": "../../../../docs/worker-profile.md"
}
