{
  "worker_id": "worker-a",
  "alias": "Worker A",
  "assistant_code": "D_worker_a",
  "assistant_level": "D",
  "window_title": "Worker A",
  "project_root": "../..",
  "agent_root": ".",
  "status": "registered",
  "supervisor_worker_id": "worker-demo-project",
  "supervisor_assistant_code": "B_demo_project",
  "scope": [
    "Handle bounded execution tasks inside the demo project"
  ],
  "staffing_standard_path": "../../../../../docs/governance.md",
  "communication_standard_path": "../../../../../coordination/README.md",
  "profile_standard_path": "../../../../../docs/worker-profile.md"
}
