{
  "worker_id": "worker-profile-manager",
  "alias": "Profile Manager",
  "assistant_code": "B_profile_manager",
  "assistant_level": "B",
  "window_title": "Profile Manager",
  "project_root": "..",
  "agent_root": ".",
  "status": "registered",
  "scope": [
    "Maintain worker profile files",
    "Maintain portable _agent_profile snapshots"
  ],
  "staffing_standard_path": "../../../docs/governance.md",
  "communication_standard_path": "../../../coordination/README.md",
  "profile_standard_path": "../../../docs/worker-profile.md"
}
